URL,Title,Meta Description,Canonical,Index,H1 Count,First H1,Schema Types,OG Image,Critical Issues,High Issues,Medium Issues,Low Issues
"/","NeuroBreath | Evidence-Based Neurodiversity Support","Evidence-based tools and resources for ADHD, autism, dyslexia and anxiety, plus breathing and focus support for families, teachers and carers across the UK.","https://neurobreath.co.uk/","index",1,"Measured breathing. Measurable relief.","Organization; WebSite; WebPage; BreadcrumbList","https://neurobreath.co.uk/og-image.png","","","",""
"/about","About NeuroBreath | Evidence-Based Neurodiversity Support","Learn how NeuroBreath delivers evidence-based neurodiversity support, our research foundations, and our commitment to inclusive wellbeing tools across the UK.","https://neurobreath.co.uk/about","index",1,"About NeuroBreath","Organization; WebSite; WebPage; BreadcrumbList","https://neurobreath.co.uk/og-image.png","","","",""
"/about-us","About NeuroBreath | Our Story and Approach","About NeuroBreath: our story, evidence-led approach and the people behind our neurodiversity resources, breathing tools and learning support.","https://neurobreath.co.uk/about-us","index",1,"About NeuroBreath","Organization; WebSite; WebPage; BreadcrumbList","https://neurobreath.co.uk/og-image.png","","","",""
"/adhd","ADHD Support Hub | NeuroBreath","Comprehensive ADHD support hub with focus tools, routines and evidence-based strategies for children, parents, teachers and carers in the UK.","https://neurobreath.co.uk/adhd","index",1,"ADHD HubEvidence-Based Support & Interactive Tools","Organization; WebSite; WebPage; BreadcrumbList","https://neurobreath.co.uk/og-image.png","","","",""
"/anxiety","Anxiety Support Hub | NeuroBreath","Evidence-based anxiety tools including breathing, grounding, CBT prompts and progress tracking to help build calm and resilience.","https://neurobreath.co.uk/anxiety","index",1,"Anxiety — Calm the Body, Train the Mind","Organization; WebSite; WebPage; BreadcrumbList","https://neurobreath.co.uk/og-image.png","","","",""
"/autism","Autism Support Hub | NeuroBreath","Evidence-based autism support with visual schedules, sensory strategies and practical tools for families, educators and autistic people.","https://neurobreath.co.uk/autism","index",1,"Autism Hub","Organization; WebSite; WebPage; BreadcrumbList","https://neurobreath.co.uk/og-image.png","","","",""
"/autism/focus-garden","Autism Support Hub | NeuroBreath","Evidence-based autism support with visual schedules, sensory strategies and practical tools for families, educators and autistic people.","https://neurobreath.co.uk/autism","index",1,"🌱 Focus Garden – Autism Condition Hub","Organization; WebSite; WebPage; BreadcrumbList","https://neurobreath.co.uk/og-image.png","","","",""
"/blog","Neurodiversity & Wellbeing Blog | NeuroBreath","Research-backed articles on neurodiversity and wellbeing, with practical strategies for ADHD, autism, anxiety, dyslexia and daily resilience.","https://neurobreath.co.uk/blog","index",1,"AI-Powered Neurodiversity & Wellbeing Hub","Organization; WebSite; WebPage; BreadcrumbList","https://neurobreath.co.uk/og-image.png","","","",""
"/breathing","Breathing Exercises for Calm & Focus | NeuroBreath","Breathing exercises for calm, focus and sleep with step-by-step guides, timers and audio cues. Evidence-informed techniques for daily use.","https://neurobreath.co.uk/breathing","index",1,"Breathing Exercises","Organization; WebSite; WebPage; BreadcrumbList","https://neurobreath.co.uk/og-image.png","","","",""
"/breathing/breath","Breathing Basics | NeuroBreath","How‑to guide to basic breathing technique, posture and pacing, with simple practice steps to build calm and body awareness.","https://neurobreath.co.uk/breathing/breath","index",1,"Breath (how‑to)","Organization; WebSite; WebPage; BreadcrumbList","https://neurobreath.co.uk/og-image.png","","","",""
"/breathing/focus","Focus Breathing | NeuroBreath","Focus training with short sprints, recovery breaks and breathing cues to steady attention, reduce mental fatigue and build sustainable study routines.","https://neurobreath.co.uk/breathing/focus","index",1,"Focus — Sprints with Recovery","Organization; WebSite; WebPage; BreadcrumbList","https://neurobreath.co.uk/og-image.png","","","",""
"/breathing/mindfulness","Mindfulness Breathing | NeuroBreath","Mindfulness breathing guide with short practices to anchor attention, ease stress and build everyday resilience, ideal for quick resets.","https://neurobreath.co.uk/breathing/mindfulness","index",1,"Mindfulness — Small, Repeated Moments","Organization; WebSite; WebPage; BreadcrumbList","https://neurobreath.co.uk/og-image.png","","","",""
"/breathing/techniques/sos-60","60‑Second SOS Breathing | NeuroBreath","60‑second SOS breathing for rapid calming during stress or panic. Quick setup, pacing and grounding prompts for immediate relief.","https://neurobreath.co.uk/breathing/techniques/sos-60","index",1,"60-second SOS — Setup","Organization; WebSite; WebPage; BreadcrumbList","https://neurobreath.co.uk/og-image.png","","","",""
"/breathing/training/focus-garden","Focus Garden Training | NeuroBreath","Focus Garden training combines breathing, attention cues and gentle progress tracking to help build steady focus over time.","https://neurobreath.co.uk/breathing/training/focus-garden","index",1,"Focus Garden","Organization; WebSite; WebPage; BreadcrumbList","https://neurobreath.co.uk/og-image.png","","","",""
"/coach","AI Wellbeing Coach | NeuroBreath","AI wellbeing coach with personalised prompts and evidence-informed guidance for anxiety, ADHD, autism and stress, plus practical next steps.","https://neurobreath.co.uk/coach","index",1,"Coach Hub","Organization; WebSite; WebPage; BreadcrumbList","https://neurobreath.co.uk/og-image.png","","","",""
"/conditions/adhd-carer","ADHD Carer Support | NeuroBreath","ADHD guidance for carers with routines, communication tips and wellbeing support to help manage daily life and build consistency.","https://neurobreath.co.uk/conditions/adhd-carer","index",1,"ADHD Carers Support Hub","Organization; WebSite; WebPage; BreadcrumbList","https://neurobreath.co.uk/og-image.png","","","",""
"/conditions/adhd-parent","ADHD Parent Support | NeuroBreath","ADHD support for parents with home routines, positive behaviour strategies and school collaboration tools for confident learning.","https://neurobreath.co.uk/conditions/adhd-parent","index",1,"ADHD Parent Support Hub","Organization; WebSite; WebPage; BreadcrumbList","https://neurobreath.co.uk/og-image.png","","","",""
"/conditions/adhd-teacher","ADHD Teacher Support | NeuroBreath","ADHD classroom support with practical adjustments, focus strategies and behaviour guidance aligned with UK SEND practice.","https://neurobreath.co.uk/conditions/adhd-teacher","index",1,"ADHD Teachers Support Hub","Organization; WebSite; WebPage; BreadcrumbList","https://neurobreath.co.uk/og-image.png","","","",""
"/conditions/anxiety","NeuroBreath | Evidence-Based Neurodiversity Support","Evidence-based tools and resources for ADHD, autism, dyslexia and anxiety, plus breathing and focus support for families, teachers and carers across the UK.","https://neurobreath.co.uk/","index",1,"Anxiety — Calm the Body, Train the Mind","Organization; WebSite; WebPage; BreadcrumbList","https://neurobreath.co.uk/og-image.png","","","",""
"/conditions/anxiety-carer","Anxiety Carer Support | NeuroBreath","Support for carers of people with anxiety, including calm routines, communication tips and guidance on when to seek help.","https://neurobreath.co.uk/conditions/anxiety-carer","index",1,"Supporting People Living with Anxiety","Organization; WebSite; WebPage; BreadcrumbList","https://neurobreath.co.uk/og-image.png","","","",""
"/conditions/anxiety-parent","Anxiety Parent Support | NeuroBreath","Support for parents helping a child with anxiety, with routines, reassurance techniques and school‑friendly strategies that build confidence.","https://neurobreath.co.uk/conditions/anxiety-parent","index",1,"Supporting Your Child Through Anxiety","Organization; WebSite; WebPage; BreadcrumbList","https://neurobreath.co.uk/og-image.png","","","",""
"/conditions/autism","Autism Support Hub | NeuroBreath","Evidence-based autism support with visual schedules, sensory strategies and practical tools for families, educators and autistic people.","https://neurobreath.co.uk/autism","index",1,"Autism Hub","Organization; WebSite; WebPage; BreadcrumbList","https://neurobreath.co.uk/og-image.png","","","",""
"/conditions/autism-carer","Autism Carer Support | NeuroBreath","Autism support for carers with daily‑living strategies, sensory tools and guidance for consistent, respectful care across settings.","https://neurobreath.co.uk/conditions/autism-carer","index",1,"Autism Carers Support Hub","Organization; WebSite; WebPage; BreadcrumbList","https://neurobreath.co.uk/og-image.png","","","",""
"/conditions/autism-parent","Autism Parent Support | NeuroBreath","Autism support for parents with communication tools, sensory strategies and routines that build confidence at home and school.","https://neurobreath.co.uk/conditions/autism-parent","index",1,"Autism Parent Support Hub","Organization; WebSite; WebPage; BreadcrumbList","https://neurobreath.co.uk/og-image.png","","","",""
"/conditions/autism-teacher","Autism Teacher Support | NeuroBreath","Autism classroom guidance with inclusive strategies, visual supports and practical adjustments for neurodiverse learners.","https://neurobreath.co.uk/conditions/autism-teacher","index",1,"Autism Teachers Support Hub","Organization; WebSite; WebPage; BreadcrumbList","https://neurobreath.co.uk/og-image.png","","","",""
"/conditions/bipolar","Bipolar Disorder Support | NeuroBreath","Bipolar disorder support guide with clear explanations, treatment overview and resources for individuals, families and educators.","https://neurobreath.co.uk/conditions/bipolar","index",1,"Understanding Bipolar Disorder","Organization; WebSite; WebPage; BreadcrumbList","https://neurobreath.co.uk/og-image.png","","","",""
"/conditions/depression","Depression Support Guide | NeuroBreath","Depression support guide with evidence-based coping tools, routines and resources for individuals and those who support them.","https://neurobreath.co.uk/conditions/depression","index",1,"Understanding Depression","Organization; WebSite; WebPage; BreadcrumbList","https://neurobreath.co.uk/og-image.png","","","",""
"/conditions/dyslexia","Dyslexia Support Hub | NeuroBreath","Dyslexia support hub with reading strategies, classroom tips and resources for learners, parents, teachers and carers, focused on confidence.","https://neurobreath.co.uk/conditions/dyslexia","index",1,"Your Complete Dyslexia Support Hub","Organization; WebSite; WebPage; BreadcrumbList","https://neurobreath.co.uk/og-image.png","","","",""
"/conditions/dyslexia-carer","Dyslexia Carer Support | NeuroBreath","Dyslexia support for carers with daily routines, communication tips and wellbeing guidance for people of all ages, including adults.","https://neurobreath.co.uk/conditions/dyslexia-carer","index",1,"Supporting Someone with Dyslexia","Organization; WebSite; WebPage; BreadcrumbList","https://neurobreath.co.uk/og-image.png","","","",""
"/conditions/dyslexia-parent","Dyslexia Parent Support | NeuroBreath","Dyslexia support for parents with home reading routines, school collaboration tips and practical resources for confidence.","https://neurobreath.co.uk/conditions/dyslexia-parent","index",1,"Supporting Your Child with Dyslexia","Organization; WebSite; WebPage; BreadcrumbList","https://neurobreath.co.uk/og-image.png","","","",""
"/conditions/dyslexia-teacher","Dyslexia Teacher Support | NeuroBreath","Dyslexia classroom support with evidence-based strategies, assessment tools and inclusive teaching resources to improve literacy and access.","https://neurobreath.co.uk/conditions/dyslexia-teacher","index",1,"Teaching Students with Dyslexia","Organization; WebSite; WebPage; BreadcrumbList","https://neurobreath.co.uk/og-image.png","","","",""
"/conditions/low-mood-burnout","Low Mood & Burnout Support | NeuroBreath","Support for low mood and burnout with gentle activation ideas, stress‑recovery routines and practical coping tools to rebuild momentum.","https://neurobreath.co.uk/conditions/low-mood-burnout","index",1,"Low Mood & Burnout","Organization; WebSite; WebPage; BreadcrumbList","https://neurobreath.co.uk/og-image.png","","","",""
"/conditions/mood","Mood Support Tools | NeuroBreath","Mood tools and guidance for tracking patterns, building routines and supporting emotional regulation in daily life with gentle prompts.","https://neurobreath.co.uk/conditions/mood","index",1,"Mood Tools","Organization; WebSite; WebPage; BreadcrumbList","https://neurobreath.co.uk/og-image.png","","","",""
"/contact","Contact NeuroBreath | Support and Enquiries","Contact the NeuroBreath team for support, partnerships or feedback. We respond promptly to families, educators and carers across the UK.","https://neurobreath.co.uk/contact","index",1,"NBCard - Digital Business Card","Organization; WebSite; WebPage; BreadcrumbList","https://neurobreath.co.uk/og-image.png","","","",""
"/downloads","Downloads & Resources | NeuroBreath","Downloadable guides, worksheets and visual supports for ADHD, autism, dyslexia and anxiety. Practical resources for classrooms and home routines.","https://neurobreath.co.uk/downloads","index",1,"Resources & Downloads","Organization; WebSite; WebPage; BreadcrumbList","https://neurobreath.co.uk/og-image.png","","","",""
"/dyslexia-reading-training","Dyslexia Reading Training | NeuroBreath","Multisensory dyslexia reading training with phonics, fluency practice and comprehension support for learners, parents and teachers.","https://neurobreath.co.uk/dyslexia-reading-training","index",1,"Multisensory Reading Development","Organization; WebSite; WebPage; BreadcrumbList","https://neurobreath.co.uk/og-image.png","","","",""
"/get-started","Get Started | NeuroBreath","Start with a personalised pathway to NeuroBreath tools for ADHD, autism, anxiety and learning support, with simple steps and recommended routines.","https://neurobreath.co.uk/get-started","index",1,"Getting Started with Neurobreath","Organization; WebSite; WebPage; BreadcrumbList","https://neurobreath.co.uk/og-image.png","","","",""
"/parent/:parentCode","Parent View | NeuroBreath","Read-only progress view for parents and carers, with secure access to session summaries, achievements and routines for the learner code provided.","https://neurobreath.co.uk/parent/%3AparentCode","noindex",1,"Learner Progress","Organization; WebSite; WebPage; BreadcrumbList","https://neurobreath.co.uk/og-image.png","","","",""
"/parent/demo-parent-123","Parent View | NeuroBreath","Read-only progress view for parents and carers, with secure access to session summaries, achievements and routines for the learner code provided.","https://neurobreath.co.uk/parent/demo-parent-123","noindex",1,"Learner Progress","Organization; WebSite; WebPage; BreadcrumbList","https://neurobreath.co.uk/og-image.png","","","",""
"/parent/test-parent","Parent View | NeuroBreath","Read-only progress view for parents and carers, with secure access to session summaries, achievements and routines for the learner code provided.","https://neurobreath.co.uk/parent/test-parent","noindex",1,"Learner Progress","Organization; WebSite; WebPage; BreadcrumbList","https://neurobreath.co.uk/og-image.png","","","",""
"/progress","Progress Dashboard | NeuroBreath","Private progress dashboard showing session history, streaks and achievements for registered users. Accessible to authorised accounts only.","https://neurobreath.co.uk/progress","noindex",1,"📊 Progress Dashboard","Organization; WebSite; WebPage; BreadcrumbList","https://neurobreath.co.uk/og-image.png","","","",""
"/resources","Resources Hub | NeuroBreath","Library of evidence-based guides, templates and printable supports for ADHD, autism, dyslexia, anxiety and wellbeing in schools and at home.","https://neurobreath.co.uk/resources","index",1,"Downloadable Resources","Organization; WebSite; WebPage; BreadcrumbList","https://neurobreath.co.uk/og-image.png","","","",""
"/rewards","Rewards & Badges | NeuroBreath","Reward badges, streaks and milestones designed to reinforce practice habits, celebrate progress and boost motivation for learners of all ages.","https://neurobreath.co.uk/rewards","index",1,"🏆 Rewards & Badges","Organization; WebSite; WebPage; BreadcrumbList","https://neurobreath.co.uk/og-image.png","","","",""
"/schools","NeuroBreath for Schools | SEND Support","SEND-friendly tools for schools, with breathing and focus activities plus guidance for supporting neurodiverse learners in UK classrooms.","https://neurobreath.co.uk/schools","index",1,"School Tools & Resources","Organization; WebSite; WebPage; BreadcrumbList","https://neurobreath.co.uk/og-image.png","","","",""
"/send-report","SEND Reports | NeuroBreath","Create and manage SEND training recommendation reports for learners, with summaries and evidence links. Not a diagnostic tool.","https://neurobreath.co.uk/send-report","noindex",1,"SEND Reports","Organization; WebSite; WebPage; BreadcrumbList","https://neurobreath.co.uk/og-image.png","","","",""
"/sleep","Sleep Support Tools | NeuroBreath","Sleep support tools with wind‑down routines, breathing timers and calming prompts to build consistent, restorative rest.","https://neurobreath.co.uk/sleep","index",1,"Sleep Issues","Organization; WebSite; WebPage; BreadcrumbList","https://neurobreath.co.uk/og-image.png","","","",""
"/stress","Stress Support Tools | NeuroBreath","Stress support resources including breathing, grounding and planning tools to reduce overwhelm and build steady day‑to‑day resilience.","https://neurobreath.co.uk/stress","index",1,"Stress — Understand, Manage, Thrive","Organization; WebSite; WebPage; BreadcrumbList","https://neurobreath.co.uk/og-image.png","","","",""
"/support-us","Support NeuroBreath | Help Our Mission","Support NeuroBreath’s mission to deliver free, evidence-based neurodiversity tools through partnerships, sponsorship or sharing feedback.","https://neurobreath.co.uk/support-us","index",1,"Support Us","Organization; WebSite; WebPage; BreadcrumbList","https://neurobreath.co.uk/og-image.png","","","",""
"/teacher-quick-pack","Teacher Quick Pack | NeuroBreath","Quick-start pack for teachers with classroom strategies, breathing tools and printable supports for neurodiverse learners.","https://neurobreath.co.uk/teacher-quick-pack","index",1,"Teacher Tools Hub","Organization; WebSite; WebPage; BreadcrumbList","https://neurobreath.co.uk/og-image.png","","","",""
"/teacher/dashboard","Teacher Dashboard | NeuroBreath","Private teacher dashboard to review learner activity, trends and classroom progress summaries, with read‑only analytics for secure access.","https://neurobreath.co.uk/teacher/dashboard","noindex",1,"Teacher Dashboard","Organization; WebSite; WebPage; BreadcrumbList","https://neurobreath.co.uk/og-image.png","","","",""
"/techniques/4-7-8","4‑7‑8 Breathing Technique | NeuroBreath","4‑7‑8 breathing technique guide for relaxation and sleep. Counted pacing, timing tips and a calm routine you can repeat daily.","https://neurobreath.co.uk/techniques/4-7-8","index",1,"4-7-8 Breathing","Organization; WebSite; WebPage; BreadcrumbList","https://neurobreath.co.uk/og-image.png","","","",""
"/techniques/box-breathing","Box Breathing Technique | NeuroBreath","Box breathing guide for steady focus and emotional regulation. Four-count rhythm with pacing tips for stress relief and clarity.","https://neurobreath.co.uk/techniques/box-breathing","index",1,"Box Breathing","Organization; WebSite; WebPage; BreadcrumbList","https://neurobreath.co.uk/og-image.png","","","",""
"/techniques/coherent","Coherent Breathing Technique | NeuroBreath","Coherent breathing at a slow, steady pace to support heart rate variability and nervous system balance, with simple timing cues.","https://neurobreath.co.uk/techniques/coherent","index",1,"Coherent Breathing","Organization; WebSite; WebPage; BreadcrumbList","https://neurobreath.co.uk/og-image.png","","","",""
"/techniques/sos","60‑Second SOS Breathing | NeuroBreath","60‑second SOS breathing guide for quick calm, with clear steps, pacing and grounding prompts to reset the body during acute stress.","https://neurobreath.co.uk/techniques/sos","index",1,"60-second SOS","Organization; WebSite; WebPage; BreadcrumbList","https://neurobreath.co.uk/og-image.png","","","",""
"/tools","Interactive Tools | NeuroBreath","Interactive tools for ADHD, autism, anxiety and dyslexia, including breathing, focus games, mood tracking and routines for everyday support.","https://neurobreath.co.uk/tools","index",1,"Breathing Tools","Organization; WebSite; WebPage; BreadcrumbList","https://neurobreath.co.uk/og-image.png","","","",""
"/tools/adhd-deep-dive/assessment","ADHD Assessment Guide | NeuroBreath","Step-by-step guide to getting an ADHD assessment in the UK, including referral routes, evidence to gather and what to expect in clinic.","https://neurobreath.co.uk/tools/adhd-deep-dive/assessment","index",1,"Getting an ADHD assessment","Organization; WebSite; WebPage; BreadcrumbList","https://neurobreath.co.uk/og-image.png","","","",""
"/tools/adhd-deep-dive/diagnosis","ADHD Diagnosis Decisions | NeuroBreath","Understand ADHD diagnosis decisions with clear explanations of criteria, common questions and how outcomes guide support at home and school.","https://neurobreath.co.uk/tools/adhd-deep-dive/diagnosis","index",1,"Diagnosis decisions","Organization; WebSite; WebPage; BreadcrumbList","https://neurobreath.co.uk/og-image.png","","","",""
"/tools/adhd-deep-dive/helplines","ADHD Helplines & Support | NeuroBreath","UK helplines, crisis options and community organisations for ADHD families, with quick steps for urgent support and ongoing guidance.","https://neurobreath.co.uk/tools/adhd-deep-dive/helplines","index",1,"Helplines, crisis options & community","Organization; WebSite; WebPage; BreadcrumbList","https://neurobreath.co.uk/og-image.png","","","",""
"/tools/adhd-deep-dive/self-care","ADHD Parent & Carer Self‑Care | NeuroBreath","Self‑care guidance for ADHD parents and carers, covering burnout prevention, stress resets and ways to protect your energy.","https://neurobreath.co.uk/tools/adhd-deep-dive/self-care","index",1,"Parent & carer self-care","Organization; WebSite; WebPage; BreadcrumbList","https://neurobreath.co.uk/og-image.png","","","",""
"/tools/adhd-deep-dive/support-at-home","ADHD Support at Home | NeuroBreath","Practical ADHD support at home: routines, reward systems, focus‑friendly spaces and communication tips that work in daily life.","https://neurobreath.co.uk/tools/adhd-deep-dive/support-at-home","index",1,"ADHD support at home","Organization; WebSite; WebPage; BreadcrumbList","https://neurobreath.co.uk/og-image.png","","","",""
"/tools/adhd-deep-dive/teens","ADHD Support for Teens | NeuroBreath","Support for ADHD teens with study planning, motivation tools, emotional regulation and healthy routines for school and life.","https://neurobreath.co.uk/tools/adhd-deep-dive/teens","index",1,"ADHD & teens","Organization; WebSite; WebPage; BreadcrumbList","https://neurobreath.co.uk/og-image.png","","","",""
"/tools/adhd-deep-dive/what-is-adhd","What Is ADHD? | NeuroBreath","Clear explanation of what ADHD is and isn’t, covering core traits, common myths and how it can present across ages at home and school.","https://neurobreath.co.uk/tools/adhd-deep-dive/what-is-adhd","index",1,"What ADHD is (and isn’t)","Organization; WebSite; WebPage; BreadcrumbList","https://neurobreath.co.uk/og-image.png","","","",""
"/tools/adhd-deep-dive/working-with-school","ADHD Support at School | NeuroBreath","How to work with schools on ADHD support, including SEND plans, adjustments and effective home–school communication to sustain progress.","https://neurobreath.co.uk/tools/adhd-deep-dive/working-with-school","index",1,"ADHD & school support","Organization; WebSite; WebPage; BreadcrumbList","https://neurobreath.co.uk/og-image.png","","","",""
"/tools/adhd-deep-dive/young-people","ADHD for Young People & Adults | NeuroBreath","ADHD guidance for young people and adults, with coping strategies, workplace tips and routes to further support for daily life.","https://neurobreath.co.uk/tools/adhd-deep-dive/young-people","index",1,"ADHD for young people & adults","Organization; WebSite; WebPage; BreadcrumbList","https://neurobreath.co.uk/og-image.png","","","",""
"/tools/adhd-focus-lab","ADHD Focus Lab | NeuroBreath","ADHD Focus Lab provides short games, breathing cues and journalling to practise attention in low‑pressure sessions and build insight.","https://neurobreath.co.uk/tools/adhd-focus-lab","index",1,"ADHD Focus Lab","Organization; WebSite; WebPage; BreadcrumbList","https://neurobreath.co.uk/og-image.png","","","",""
"/tools/adhd-tools","ADHD Tools & Focus Hub | NeuroBreath","ADHD tools including focus timers, routines, reward systems and planning supports to help manage attention and executive function.","https://neurobreath.co.uk/tools/adhd-tools","index",1,"ADHD Tools & Focus Hub","Organization; WebSite; WebPage; BreadcrumbList","https://neurobreath.co.uk/og-image.png","","","",""
"/tools/anxiety-tools","Anxiety Toolkit | NeuroBreath","Anxiety toolkit with breathing, grounding, CBT prompts and mood tracking to build calm, reduce worry and strengthen coping skills.","https://neurobreath.co.uk/tools/anxiety-tools","index",1,"Anxiety Toolkit","Organization; WebSite; WebPage; BreadcrumbList","https://neurobreath.co.uk/og-image.png","","","",""
