URL,Title,Meta Description,Canonical,Index,H1 Count,First H1,Schema Types,OG Image,Critical Issues,High Issues,Medium Issues,Low Issues
"/tools/autism-tools","Autism Tools & Support Hub | NeuroBreath","Autism support tools including visual schedules, sensory calming activities and communication aids for home and school, built for routine.","https://neurobreath.co.uk/tools/autism-tools","index",1,"Autism Tools & Support Hub","Organization; WebSite; WebPage; BreadcrumbList","https://neurobreath.co.uk/og-image.png","","","",""
"/tools/breath-ladder","Breath Ladder | NeuroBreath","Breath Ladder trains gradual pacing and lung control with step-by-step levels, helping users build calm and concentration.","https://neurobreath.co.uk/tools/breath-ladder","index",1,"Breath Ladder","Organization; WebSite; WebPage; BreadcrumbList","https://neurobreath.co.uk/og-image.png","","","",""
"/tools/breath-tools","Breath Tools & Timers | NeuroBreath","Breath tools and timers for calm, focus and sleep, with guided cues and accessible practice options for home and classrooms.","https://neurobreath.co.uk/tools/breath-tools","index",1,"Breath Tools","Organization; WebSite; WebPage; BreadcrumbList","https://neurobreath.co.uk/og-image.png","","","",""
"/tools/colour-path","Colour‑Path Breathing | NeuroBreath","Colour‑Path breathing uses visual tracing and paced prompts to support calm, focus and sensory regulation, ideal for short resets.","https://neurobreath.co.uk/tools/colour-path","index",1,"Colour-Path Breathing","Organization; WebSite; WebPage; BreadcrumbList","https://neurobreath.co.uk/og-image.png","","","",""
"/tools/depression-tools","Depression Support Tools | NeuroBreath","Depression support tools for low mood, including gentle activation prompts, routine builders and coping resources to support momentum.","https://neurobreath.co.uk/tools/depression-tools","index",1,"Depression — Tools, Management & Recovery","Organization; WebSite; WebPage; BreadcrumbList","https://neurobreath.co.uk/og-image.png","","","",""
"/tools/focus-tiles","Focus Tiles | NeuroBreath","Focus Tiles delivers short attention games and prompts to build concentration, task-starting momentum and positive study habits.","https://neurobreath.co.uk/tools/focus-tiles","index",1,"Focus Tiles","Organization; WebSite; WebPage; BreadcrumbList","https://neurobreath.co.uk/og-image.png","","","",""
"/tools/focus-training","Focus Training | NeuroBreath","Focus training with paced sprints, breathing cues and recovery breaks to build sustainable attention for work and study.","https://neurobreath.co.uk/tools/focus-training","index",1,"Focus — Sprints with Recovery","Organization; WebSite; WebPage; BreadcrumbList","https://neurobreath.co.uk/og-image.png","","","",""
"/tools/mood-tools","Mood Tools | NeuroBreath","Mood tools for tracking, reflection and regulation, including check-ins, journalling and grounding prompts for emotional balance.","https://neurobreath.co.uk/tools/mood-tools","index",1,"Mood Tools","Organization; WebSite; WebPage; BreadcrumbList","https://neurobreath.co.uk/og-image.png","","","",""
"/tools/roulette","Micro‑Reset Roulette | NeuroBreath","Micro‑Reset Roulette offers quick wellbeing breaks, breathing and movement prompts to reduce overwhelm and restore attention in minutes.","https://neurobreath.co.uk/tools/roulette","index",1,"Micro-Reset Roulette","Organization; WebSite; WebPage; BreadcrumbList","https://neurobreath.co.uk/og-image.png","","","",""
"/tools/sleep-tools","Sleep Tools | NeuroBreath","Sleep tools with wind‑down routines, breathing timers and calming prompts to support better rest and steady bedtime habits.","https://neurobreath.co.uk/tools/sleep-tools","index",1,"Sleep Tools","Organization; WebSite; WebPage; BreadcrumbList","https://neurobreath.co.uk/og-image.png","","","",""
"/tools/stress-tools","Stress Tools | NeuroBreath","Stress tools including breathing, grounding and prioritisation prompts to reduce overwhelm, steady focus and support daily resilience.","https://neurobreath.co.uk/tools/stress-tools","index",1,"Stress — Understand, Manage, Thrive","Organization; WebSite; WebPage; BreadcrumbList","https://neurobreath.co.uk/og-image.png","","","",""
